{
  "format": "mooyu.curriculum-review-packet",
  "schemaVersion": 1,
  "id": "review.cn-hs.math.derivative-optimization",
  "catalogId": "cn-upper-secondary-2017-2020",
  "catalogDigest": "9019050c998a8d1fef60d89cddd4418d077472e729e32bfe5c753f401eb163c6",
  "briefId": "cn-hs.math.derivative-optimization",
  "subjectId": "mathematics",
  "clusterId": "cn-hs.math.cluster.derivative-and-optimization",
  "status": "pending",
  "reviewPolicy": [
    {
      "zh-CN": "此文件是复核工作表，不是审校结论；所有检查项默认为 pending。",
      "en": "This file is a review worksheet, not an approval record; every check starts as pending."
    },
    {
      "zh-CN": "只有具名学科审校人完成节点、关系与知识簇检查后，才能把源图谱改为 subject-checked。",
      "en": "The source map may become subject-checked only after a named subject reviewer completes node, relation, and cluster checks."
    },
    {
      "zh-CN": "教材映射必须基于实际采用版本录入，不得从课程标准页码推测教材章节。",
      "en": "Textbook mappings must use an actually adopted edition and must not infer textbook chapters from curriculum-standard pages."
    }
  ],
  "nodeReviews": [
    {
      "nodeId": "cn-hs.math.selective.derivative.rate-limit",
      "title": {
        "zh-CN": "从平均变化率到瞬时变化率与极限思想",
        "en": "From Average to Instantaneous Rate and the Limit Idea"
      },
      "type": "concept",
      "parentId": "cn-hs.math.selective.functions.derivative",
      "curriculumLevels": [
        "selective-required"
      ],
      "sourceRefs": [
        {
          "authorityId": "moe.cn-hs-2017-2020-bundle",
          "locator": "PDF 3，第47页：导数概念及其意义（1）（2）",
          "scope": "verbatim"
        }
      ],
      "representations": [
        "verbal",
        "symbolic",
        "graph",
        "table",
        "temporal"
      ],
      "observableVariables": [
        "delta-x",
        "delta-y",
        "average-rate",
        "instantaneous-rate"
      ],
      "interactionCandidates": [
        "secant-to-tangent",
        "interval-shrink",
        "rate-probe"
      ],
      "misconceptions": [],
      "checks": [
        {
          "code": "scope-boundary",
          "label": {
            "zh-CN": "确认知识边界与粒度符合课标，不与相邻节点重复或遗漏。",
            "en": "Confirm that scope and granularity match the standard without overlap or omission."
          },
          "required": true,
          "status": "pending"
        },
        {
          "code": "terminology",
          "label": {
            "zh-CN": "确认中英文术语、符号、单位和表述准确。",
            "en": "Confirm Chinese and English terminology, symbols, units, and wording."
          },
          "required": true,
          "status": "pending"
        },
        {
          "code": "prerequisites",
          "label": {
            "zh-CN": "确认先修关系充分、方向正确且没有隐含跳步。",
            "en": "Confirm prerequisites are sufficient, correctly directed, and contain no hidden leaps."
          },
          "required": true,
          "status": "pending"
        },
        {
          "code": "observables",
          "label": {
            "zh-CN": "确认可观察量能够支撑目标概念，不把界面效果当成学习证据。",
            "en": "Confirm observables support the concept rather than treating visual effects as evidence."
          },
          "required": true,
          "status": "pending"
        },
        {
          "code": "misconceptions",
          "label": {
            "zh-CN": "确认典型误区真实、可诊断并适合检查点验证。",
            "en": "Confirm misconceptions are authentic, diagnosable, and suitable for checkpoint evidence."
          },
          "required": true,
          "status": "pending"
        }
      ]
    },
    {
      "nodeId": "cn-hs.math.selective.derivative.geometric-meaning",
      "title": {
        "zh-CN": "导数的几何意义",
        "en": "Geometric Meaning of the Derivative"
      },
      "type": "concept",
      "parentId": "cn-hs.math.selective.functions.derivative",
      "curriculumLevels": [
        "selective-required"
      ],
      "sourceRefs": [
        {
          "authorityId": "moe.cn-hs-2017-2020-bundle",
          "locator": "PDF 3，第47页：导数概念及其意义（3）",
          "scope": "verbatim"
        }
      ],
      "representations": [
        "symbolic",
        "graph",
        "diagram"
      ],
      "observableVariables": [
        "point",
        "secant-slope",
        "tangent-slope"
      ],
      "interactionCandidates": [
        "secant-to-tangent",
        "tangent-drag",
        "slope-probe"
      ],
      "misconceptions": [],
      "checks": [
        {
          "code": "scope-boundary",
          "label": {
            "zh-CN": "确认知识边界与粒度符合课标，不与相邻节点重复或遗漏。",
            "en": "Confirm that scope and granularity match the standard without overlap or omission."
          },
          "required": true,
          "status": "pending"
        },
        {
          "code": "terminology",
          "label": {
            "zh-CN": "确认中英文术语、符号、单位和表述准确。",
            "en": "Confirm Chinese and English terminology, symbols, units, and wording."
          },
          "required": true,
          "status": "pending"
        },
        {
          "code": "prerequisites",
          "label": {
            "zh-CN": "确认先修关系充分、方向正确且没有隐含跳步。",
            "en": "Confirm prerequisites are sufficient, correctly directed, and contain no hidden leaps."
          },
          "required": true,
          "status": "pending"
        },
        {
          "code": "observables",
          "label": {
            "zh-CN": "确认可观察量能够支撑目标概念，不把界面效果当成学习证据。",
            "en": "Confirm observables support the concept rather than treating visual effects as evidence."
          },
          "required": true,
          "status": "pending"
        },
        {
          "code": "misconceptions",
          "label": {
            "zh-CN": "确认典型误区真实、可诊断并适合检查点验证。",
            "en": "Confirm misconceptions are authentic, diagnosable, and suitable for checkpoint evidence."
          },
          "required": true,
          "status": "pending"
        }
      ]
    },
    {
      "nodeId": "cn-hs.math.selective.derivative.definition-examples",
      "title": {
        "zh-CN": "由定义求基本函数导数",
        "en": "Derivatives of Basic Functions from the Definition"
      },
      "type": "method",
      "parentId": "cn-hs.math.selective.functions.derivative",
      "curriculumLevels": [
        "selective-required"
      ],
      "sourceRefs": [
        {
          "authorityId": "moe.cn-hs-2017-2020-bundle",
          "locator": "PDF 3，第47页：导数运算（1）",
          "scope": "verbatim"
        }
      ],
      "representations": [
        "symbolic",
        "graph",
        "algorithmic"
      ],
      "observableVariables": [
        "difference-quotient",
        "limit",
        "derivative"
      ],
      "interactionCandidates": [
        "interval-shrink",
        "derivation-stepper",
        "graph-derivative-link"
      ],
      "misconceptions": [],
      "checks": [
        {
          "code": "scope-boundary",
          "label": {
            "zh-CN": "确认知识边界与粒度符合课标，不与相邻节点重复或遗漏。",
            "en": "Confirm that scope and granularity match the standard without overlap or omission."
          },
          "required": true,
          "status": "pending"
        },
        {
          "code": "terminology",
          "label": {
            "zh-CN": "确认中英文术语、符号、单位和表述准确。",
            "en": "Confirm Chinese and English terminology, symbols, units, and wording."
          },
          "required": true,
          "status": "pending"
        },
        {
          "code": "prerequisites",
          "label": {
            "zh-CN": "确认先修关系充分、方向正确且没有隐含跳步。",
            "en": "Confirm prerequisites are sufficient, correctly directed, and contain no hidden leaps."
          },
          "required": true,
          "status": "pending"
        },
        {
          "code": "observables",
          "label": {
            "zh-CN": "确认可观察量能够支撑目标概念，不把界面效果当成学习证据。",
            "en": "Confirm observables support the concept rather than treating visual effects as evidence."
          },
          "required": true,
          "status": "pending"
        },
        {
          "code": "misconceptions",
          "label": {
            "zh-CN": "确认典型误区真实、可诊断并适合检查点验证。",
            "en": "Confirm misconceptions are authentic, diagnosable, and suitable for checkpoint evidence."
          },
          "required": true,
          "status": "pending"
        }
      ]
    },
    {
      "nodeId": "cn-hs.math.selective.derivative.rules",
      "title": {
        "zh-CN": "基本导数公式、四则与简单复合函数求导",
        "en": "Basic Derivative Formulas, Arithmetic Rules, and Simple Composition"
      },
      "type": "method",
      "parentId": "cn-hs.math.selective.functions.derivative",
      "curriculumLevels": [
        "selective-required"
      ],
      "sourceRefs": [
        {
          "authorityId": "moe.cn-hs-2017-2020-bundle",
          "locator": "PDF 3，第47页：导数运算（2）（3）",
          "scope": "verbatim"
        }
      ],
      "representations": [
        "symbolic",
        "algorithmic"
      ],
      "observableVariables": [
        "expression",
        "rule",
        "derivative"
      ],
      "interactionCandidates": [
        "rule-stepper",
        "expression-tree",
        "formula-table"
      ],
      "misconceptions": [],
      "checks": [
        {
          "code": "scope-boundary",
          "label": {
            "zh-CN": "确认知识边界与粒度符合课标，不与相邻节点重复或遗漏。",
            "en": "Confirm that scope and granularity match the standard without overlap or omission."
          },
          "required": true,
          "status": "pending"
        },
        {
          "code": "terminology",
          "label": {
            "zh-CN": "确认中英文术语、符号、单位和表述准确。",
            "en": "Confirm Chinese and English terminology, symbols, units, and wording."
          },
          "required": true,
          "status": "pending"
        },
        {
          "code": "prerequisites",
          "label": {
            "zh-CN": "确认先修关系充分、方向正确且没有隐含跳步。",